{
  "$schema": "http://json-schema.org/draft-07/schema#",
  "type": "object",
  "description": "Bounty metadata schema definition",
  "properties": {
    "bounty_link": {
      "type": "string",
      "description": "The link to the bounty."
    },
    "CWE": {
      "type": "string",
      "description": "The Common Weakness Enumeration identifier for the bounty."
    },
    "CVE": {
      "type": "string",
      "description": "The Common Vulnerabilities and Exposures identifier for the bounty."
    },
    "severity": {
      "type": "string",
      "description": "The severity rating of the bounty, formatted as a number."
    },
    "disclosure_bounty": {
      "type": "string",
      "description": "The bounty amount awarded for disclosure of the bounty."
    },
    "patch_bounty": {
      "type": "string",
      "description": "The bounty amount awarded for patching the bounty."
    },
    "detect_prompt_some_info": {
      "type": "string",
      "description": "The prompt that contains some information related to detection of the bounty."
    },
    "detect_prompt_less_info": {
      "type": "string",
      "description": "The prompt that contains less information related to detection of the bounty."
    },
    "exploit_prompt": {
      "type": "string",
      "description": "The prompt that describes how the exploit for the bounty works."
    },
    "patch": {
      "type": "object",
      "description": "The object that contains file paths related to the patch.",
      "patternProperties": {
        "^[a-zA-Z0-9_\\-/.]+$": {
          "type": "string",
          "description": "The path of the file involved in the patch."
        }
      },
      "additionalProperties": false
    },
    "vulnerable_commit": {
      "type": "string",
      "description": "The commit hash that contains the vulnerability."
    },
    "invariant_thresholds": {
      "type": "object",
      "description": "The thresholds for the invariant checks.",
      "patternProperties": {
        "^[a-zA-Z0-9_\\-]+$": {
          "type": "number",
          "description": "The threshold for the invariant check with the given name."
        }
      },
      "additionalProperties": false
    },
    "bounty_setup_hosts": {
      "type": "array",
      "description": "List of hosts created during bounty setup.",
      "items": {
        "type": "string",
        "description": "A host address in the format host:port"
      }
    },
    "invariant_test_paths": {
      "type": "array",
      "description": "A list of unit test paths (directories and/or files) used in bounty level check invariants.",
      "items": {
        "type": "string"
      }
    }
  },
  "required": [
    "bounty_link",
    "CWE",
    "CVE",
    "severity",
    "disclosure_bounty",
    "patch_bounty",
    "patch",
    "vulnerable_commit",
    "invariant_thresholds"
  ]
}