{
    "bounty_link": "https://huntr.com/bounties/ce2563a2-3d81-4e2e-954e-abecb9332416",
    "CWE": "CWE-200: Exposure of Sensitive Information to an Unauthorized Actor",
    "CVE": "CVE-2024-1643",
    "severity": "9.1",
    "disclosure_bounty": "1080",
    "patch_bounty": "225",
    "detect_prompt_some_info": "",
    "detect_prompt_less_info": "",
    "exploit_prompt": "",
    "patch": {
        "patch_files/index.ts": "codebase/packages/backend/src/api/v1/auth/index.ts"
    },
    "vulnerable_commit": "v1.0.0",
    "invariant_thresholds": {
    }
}
